{
  "schema_version": "diamond360-descriptor-profile/1",
  "certificate": "IGI-LG756520111",
  "window_contract": {
    "id": "core17",
    "source_indices": [
      248,
      249,
      250,
      251,
      252,
      253,
      254,
      255,
      0,
      1,
      2,
      3,
      4,
      5,
      6,
      7,
      8
    ],
    "wrap_explicit": true,
    "source_step_semantics": "ordinal samples; not seconds or calibrated degrees"
  },
  "measurements": {
    "activity.activation.whole_stone_total_excursion": {
      "value": 0.11018902063369751,
      "status": "review",
      "reasons": [
        "foreground_or_nonuniformity_on_border",
        "outline_near_image_edge"
      ],
      "source_refs": [
        "docs/360/activation/summary.json",
        "docs/360/activation/dispositions.json"
      ]
    },
    "activity.activation.centre_relative_total_excursion": {
      "value": 0.05962840099786483,
      "status": "review",
      "reasons": [
        "foreground_or_nonuniformity_on_border",
        "outline_near_image_edge"
      ],
      "source_refs": [
        "docs/360/activation/summary.json",
        "docs/360/activation/dispositions.json"
      ]
    },
    "activity.activation.inner_relative_total_excursion": {
      "value": 0.07962734198553362,
      "status": "review",
      "reasons": [
        "foreground_or_nonuniformity_on_border",
        "outline_near_image_edge"
      ],
      "source_refs": [
        "docs/360/activation/summary.json",
        "docs/360/activation/dispositions.json"
      ]
    },
    "activity.activation.middle_relative_total_excursion": {
      "value": 0.020733704704706646,
      "status": "review",
      "reasons": [
        "foreground_or_nonuniformity_on_border",
        "outline_near_image_edge"
      ],
      "source_refs": [
        "docs/360/activation/summary.json",
        "docs/360/activation/dispositions.json"
      ]
    },
    "activity.mobility.centre_median": {
      "value": 0.011099420627681059,
      "status": "review",
      "reasons": [
        "foreground_or_nonuniformity_on_border",
        "outline_near_image_edge"
      ],
      "source_refs": [
        "docs/360/mobility/summary.json",
        "docs/360/mobility/dispositions.json"
      ]
    },
    "activity.mobility.inner_median": {
      "value": 0.009986337360752516,
      "status": "review",
      "reasons": [
        "foreground_or_nonuniformity_on_border",
        "outline_near_image_edge"
      ],
      "source_refs": [
        "docs/360/mobility/summary.json",
        "docs/360/mobility/dispositions.json"
      ]
    },
    "activity.mobility.middle_median": {
      "value": 0.004622994864987434,
      "status": "review",
      "reasons": [
        "foreground_or_nonuniformity_on_border",
        "outline_near_image_edge"
      ],
      "source_refs": [
        "docs/360/mobility/summary.json",
        "docs/360/mobility/dispositions.json"
      ]
    },
    "dark_state.occupancy.centre_mean": {
      "value": 0.04277334202379013,
      "status": "review",
      "reasons": [
        "foreground_or_nonuniformity_on_border",
        "outline_near_image_edge"
      ],
      "source_refs": [
        "docs/360/occupancy/summary.json",
        "docs/360/occupancy/dispositions.json"
      ]
    },
    "dark_state.occupancy.inner_mean": {
      "value": 0.08233515180265655,
      "status": "review",
      "reasons": [
        "foreground_or_nonuniformity_on_border",
        "outline_near_image_edge"
      ],
      "source_refs": [
        "docs/360/occupancy/summary.json",
        "docs/360/occupancy/dispositions.json"
      ]
    },
    "dark_state.occupancy.middle_mean": {
      "value": 0.09286987522281641,
      "status": "review",
      "reasons": [
        "foreground_or_nonuniformity_on_border",
        "outline_near_image_edge"
      ],
      "source_refs": [
        "docs/360/occupancy/summary.json",
        "docs/360/occupancy/dispositions.json"
      ]
    },
    "dark_state.persistence.inner_dark_q90_window_fraction": {
      "value": 0.17647058823529413,
      "status": "review",
      "reasons": [
        "foreground_or_nonuniformity_on_border",
        "outline_near_image_edge"
      ],
      "source_refs": [
        "docs/360/persistence/summary.json",
        "docs/360/persistence/dispositions.json"
      ]
    },
    "temporal_reconfiguration.switching.inner_rate": {
      "value": 0.06979796706989247,
      "status": "review",
      "reasons": [
        "foreground_or_nonuniformity_on_border",
        "outline_near_image_edge"
      ],
      "source_refs": [
        "docs/360/switching/summary.json",
        "docs/360/switching/dispositions.json"
      ]
    },
    "temporal_reconfiguration.switching.middle_rate": {
      "value": 0.06686789772727272,
      "status": "review",
      "reasons": [
        "foreground_or_nonuniformity_on_border",
        "outline_near_image_edge"
      ],
      "source_refs": [
        "docs/360/switching/summary.json",
        "docs/360/switching/dispositions.json"
      ]
    },
    "nested_step.centre_inner_pearson": {
      "value": 0.4860299445,
      "status": "review",
      "reasons": [
        "foreground_or_nonuniformity_on_border",
        "outline_near_image_edge"
      ],
      "source_refs": [
        "docs/360/coordination/summary.json",
        "docs/360/coordination/dispositions.json",
        "docs/360/activation/summary.json"
      ]
    },
    "nested_step.inner_middle_pearson": {
      "value": 0.49059073,
      "status": "review",
      "reasons": [
        "foreground_or_nonuniformity_on_border",
        "outline_near_image_edge"
      ],
      "source_refs": [
        "docs/360/coordination/summary.json",
        "docs/360/coordination/dispositions.json",
        "docs/360/activation/summary.json"
      ]
    },
    "directional.side_E_W_pearson": {
      "value": 0.014666301957435974,
      "status": "review",
      "reasons": [
        "foreground_or_nonuniformity_on_border",
        "outline_near_image_edge"
      ],
      "source_refs": [
        "docs/360/opposing-symmetry/summary.json",
        "docs/360/opposing-symmetry/dispositions.json"
      ]
    },
    "directional.side_N_S_pearson": {
      "value": -0.9146084182603903,
      "status": "review",
      "reasons": [
        "foreground_or_nonuniformity_on_border",
        "outline_near_image_edge"
      ],
      "source_refs": [
        "docs/360/opposing-symmetry/summary.json",
        "docs/360/opposing-symmetry/dispositions.json"
      ]
    },
    "directional.corner_NE_SW_pearson": {
      "value": -0.7074131838565342,
      "status": "review",
      "reasons": [
        "foreground_or_nonuniformity_on_border",
        "outline_near_image_edge"
      ],
      "source_refs": [
        "docs/360/opposing-symmetry/summary.json",
        "docs/360/opposing-symmetry/dispositions.json"
      ]
    },
    "directional.corner_NW_SE_pearson": {
      "value": 0.4781102364393397,
      "status": "review",
      "reasons": [
        "foreground_or_nonuniformity_on_border",
        "outline_near_image_edge"
      ],
      "source_refs": [
        "docs/360/opposing-symmetry/summary.json",
        "docs/360/opposing-symmetry/dispositions.json"
      ]
    },
    "flash_morphology.median_largest_component_fraction": {
      "value": 0.12614789753504108,
      "status": "review",
      "reasons": [
        "foreground_or_nonuniformity_on_border",
        "outline_near_image_edge"
      ],
      "source_refs": [
        "docs/360/morphology/summary.json",
        "docs/360/morphology/dispositions.json"
      ]
    }
  },
  "context": {
    "flash_morphology.active_frame_fraction": {
      "value": 0.7647058823529411,
      "status": "review",
      "reasons": [
        "foreground_or_nonuniformity_on_border",
        "outline_near_image_edge"
      ],
      "source_refs": [
        "docs/360/morphology/summary.json",
        "docs/360/morphology/dispositions.json"
      ]
    }
  },
  "field_catalog": {
    "measurements": {
      "activity.activation.whole_stone_total_excursion": {
        "role": "descriptor",
        "descriptor_provenance": {
          "issue": 26,
          "descriptor_schema": "diamond360-activation/1",
          "benchmark_schema": "diamond360-activation-benchmark/1",
          "summary_path": "docs/360/activation/summary.json",
          "dispositions_path": "docs/360/activation/dispositions.json"
        },
        "window_contract": "core17",
        "representation": "whole_stone",
        "support_policy": "fixed",
        "statistic": "total_excursion",
        "units": "encoded_brightness",
        "region": "whole_stone",
        "trace_type": "raw",
        "redundancy_group": "activity_motion"
      },
      "activity.activation.centre_relative_total_excursion": {
        "role": "descriptor",
        "descriptor_provenance": {
          "issue": 26,
          "descriptor_schema": "diamond360-activation/1",
          "benchmark_schema": "diamond360-activation-benchmark/1",
          "summary_path": "docs/360/activation/summary.json",
          "dispositions_path": "docs/360/activation/dispositions.json"
        },
        "window_contract": "core17",
        "representation": "coarse",
        "support_policy": "fixed",
        "statistic": "total_excursion",
        "units": "log_brightness_ratio",
        "region": "centre",
        "trace_type": "relative",
        "redundancy_group": "activity_motion"
      },
      "activity.activation.inner_relative_total_excursion": {
        "role": "descriptor",
        "descriptor_provenance": {
          "issue": 26,
          "descriptor_schema": "diamond360-activation/1",
          "benchmark_schema": "diamond360-activation-benchmark/1",
          "summary_path": "docs/360/activation/summary.json",
          "dispositions_path": "docs/360/activation/dispositions.json"
        },
        "window_contract": "core17",
        "representation": "coarse",